title,text,Fake or Real,date,num_text_numerical,weekOfDay
"Sad Covid story, but author resorts to misinformation and propaganda",i was reading this story today while i feel sad for authors family loss i cant help notice that author makes some politically motivated wrong conclusions presidents callous words swirling my head after my mothers death from covid here are just some my observations these are just imho you dont have agree course first constant mentioning trump annoying he has his flaws but blame him for her mothers death unfair facility elderly people where her father was infected with covid clearly at fault here second she keeps saying that her parents were republicans but how does their political affiliation matter this story would outcome be any different if they were democrats i dont think so her mother was taking all precautions wearing mask while out washing hands helped her not contract covid at stores other public places what got her infected was her husband who turn got infected at senior care center third shes talking about her mother being so active healthy that reader would think shes fairly young probably her then end author states that mother was years old healthy most us will never get live that age sean connery died today he was just if we do we will have major health problems my father passed away at was easier say what illness he didnt have at his age this lady was years older say she was perfectly healthy stretch finally she keeps referring trumps speedy recovery from covid what does she expect as president he has best health care world with top doctors treatments most us including her mother do not have this luxury trump much younger than her mother which makes huge difference btw this top notch care provided all top politicians case they get sick i can guarantee if pence biden harris pelosi mcconnell scotus judge or any member senatorcongressstate government get infected with covid chances them dying are virtually nonexistent do you know any high level politician who died from covid they are just different league than most us overall this article feels like bunch propaganda fake news its shame that author decided use her family tragedy write an election hack,F,2020-10-31 15:31:01,433,5
What are some good sources for reliable information?,this information could be news aswell as science history other factual informations,F,2020-10-27 18:52:04,13,1
Nigel Farage Fake News Lies - Nigel Green deVere CEO,nigel farage fake news lies nigel green devere ceo,F,2020-10-27 07:44:19,11,1
Latest story (non necessary godaddy site spam breaks the internet!”,on october nd news reporter tom arthur discovered sites made with godaddy website builder all sites had something do with either scams felonies fake sex tools dark wiki fake homes products much much more sites were shut down on october rd at am est,F,2020-10-24 00:49:23,53,5
Fake Facebook Post? How can someone tell?,this fake post ive seen shared my newsfeed but i cant find source post layout looks off with facebook for android heading i dont see that on fb posts anymore i own an android phone post shared with only friends liked times but not showing any friend names that liked names image were redacted image shared with me thoughts comments facts,F,2020-10-22 15:29:59,79,3
Russia’s disinformation campaign on the US election(s)?,who do yall think russia wants win this time i could see this campaign as being double bluff honesty itd be nuts if they were leaning towards president more like biden entire time order ever so slightly pull us away from democracy putin does have lot time make his moves high chair im using this campaign decide on who vote for so you might secure my vote if i cant figure out myself this where i do my reading,F,2020-10-17 22:48:33,96,5
AI Chrome Extension to Fight Fake News,hey everyone ive been working with team over past few months design create an ai chrome extension that fights fake news our concept had be critically sound so we consulted range experts are continuing do so now find main points provide when critically thinking decipher truth news our extension detects media bias provides information on ownership partisanship links alternative media sources on same page we also prompt recency opinion bias we believe its most comprehensive tool fight misinformation right now please sign up for our launch which will be over coming weeks here make sure watch our video explainer on our website which which show you how works real time look forward your critical feedback on this hope starts journey fighting misinformation at click button an open mind,F,2020-10-14 14:17:02,162,2
Makeshift Masks for Tomorrow's Future,x b,F,2020-10-14 03:06:52,2,2
"We want to make a fake news related app for school, but we need opinions!",hello lovely people our names are michelle ruben malvin we are students from netherlands we study multimedia design communication we are conducting research on fake news impact has on certain groups our target audience children who argue with parents about them spreading said fake news or believing conspiracy theories since two members our group have same issues with their parents only felt natural do so after lot research we found out that we are far from only ones with this issue one our group already member this subreddit one them found actually one who came up with idea ask for opinions here so we want solve issue where children their parents are constantly or periodically arguing about said subjects research we found out that there are lot children who are anxious about even starting discussion or trying tell their parents how much hurts but since we are not psychologists we cannot directly headon tackle this discussion turn into conversation what we can do offer communityfeeling which helps these victims unlike reddit we would love show personal growth as well dont worry we are not trying tackle reddit but are just trying get best out our school assignment that doesnt mean we dont want best for these victims course we have lot intrinsic motivation try tackle this issue what we need from you lovely people an opinion or ideas we want design an app with goal not needing app anymore after while or keep help others so if you guys would just like tell us if an app like this would be possible solution that would be amazing we obviously understand not everyone this reddit has fake news conspiracy issue but we would still like your help as well because subject just leading but not only subject we can maybe solve with this community app app has few big aspects we want design community forum where people can post their stories other people can react only with an account because we dont want trolls just be able comment we want moderate these trolls ban them we want safe environment for all we want design possibility have on chat if things are be that bit more private or maybe if you live close want meet up or skype up we want design diary section which will be completely private for just you you can post your own stories that day week discussion or advancement we want people with same kind issues find each other by tags open other ways tackle this course privacy top priority so accounts can be made anonymously no need fill first last name will be optional do so we want people listen share help get help this community we will put some educational part where conversationtips other tips surrounding these subjects will be available for all forum posts can be read by everyone but posted without name this so parents who stumble upon this app might use reflect on themselves but there always but you can only react on topics if you have an account people who posts on forum will be able choose keep forum post locked read for only those with an account so there are few ideas set rules we want design for app if you have any tips they are more than welcome also we just want know do you need this would you like have an app like this because if we were take this our teachers we would love know if what we want create if something people actually need you can also check out important app windows link down below these are low fidelity thanks so much love you all,F,2020-09-23 09:23:23,752,2
Dubio - community-driven platform for debunking false claims - looking for front-end developer!,with ongoing coronavirus pandemic upcoming us presidential elections issue fake news has once again come into spotlight with dubio we decided develop communitydriven platform for debunking false claims order ensure that fake news identified quickly reliably worldwide idea was launched april may we won euvsvirus hackathon category mitigating fake news spreading largest hackathon ever organised with over participants now were hard at work developing our mvp our team currently consists volunteer coders designers but were still looking for good frontend developer if you or someone you know have right skills are interested tackling issue fake news please get touch via pm concretely for frontend development were looking for one two profiles either someone whos proficient react angular or vue or someone whos proficient aspnet as frontend developer you will form part our core development team will contribute setting up platforms website as well as integration with our backend pipeline our team based different countries so all work done online since were all working on this as volunteers we have pretty relaxed timeline but we ask participants contribute couple hours week project give frontend developers an idea website image below shows design our main factcheck claim page design based on vikinger htmlcss template so template files can be used help facilitate website development dubio factcheck claim page mockup on factcheck claim page platform users see suspicious claim from trending online article or video can collaboratively submit relevant factchecking information regarding that claim summary claim who made claim when where relevant sources for factchecking this claim sources which either contradict or confirm claim users can add their own contributions certain claim or upvote downvote contributions made by other users once we have enough quality contributions regarding certain claim various users factchecking contributions are packaged users can decide whether claim true mostly true misleading lacking evidence mostly false false etc this information then bundled into factchecking article submitted claimreview which signals factcheck google twitter facebook inform their strategies regarding which content promote which content limit or sent professional factchecking organisation so they have all necessary resources write up good factchecking article signal this google twitter facebook limit spread false claims essentially we want crowdsource factchecking process give regular citizens necessary tools fight fake news if youd like more info on our communitydriven factchecking approach please check out our website if youre frontend developer want form part dedicated international team addressing issue fake news dont hesitate send me pm wed be happy discuss workings platform frontend more detail,F,2020-09-11 09:38:06,544,4
Atlantic's Trump Quote was Actually Movie Quote,atlantic claim that trump said troops were suckers losers whats for them was stolen from line godfather not only did event from anonymous source not happen but they took quote from fucking movie this modern day journalism,F,2020-09-08 12:36:42,49,1
why do people not fact check stuff they hear on YOUTUBE,im just having hard time understanding this because didnt take long time i just spent mintues on google known health related website figure out truth,F,2020-08-30 23:03:31,33,6
Chrome/Firefox plugin that maybe useful,entity explosion plugin for chrome or firefox that can give you any links that wikipedia site wikidata has about subject page you are looking at this would for example give you further information about someone whose biography you are looking at so help decide their legitimacy on topic x b,F,2020-08-24 06:52:53,60,0
Reddit wages war against subreddits spreading hateful content & fake news.,reddit has banned nearly subreddits including repeat offenders under its newly revised moderation policy banned subreddits include those with names descriptions that were inherently harmful those with large fraction hateful content those that positively engage with hateful content this was posted by reddit user uworstnerd member platforms safety team,F,2020-08-23 00:53:26,60,6
Dimos On-demand Crowd-Sourced Fact-Check Bot,weve recently launched factchecking program that uses multiple sources like mediabiasfactcheck international factchecking network our own team factcheckers all you have do give us link article or post you want factcheck shortly after our team will return verdict summary link fact that supports our verdict its currently live on twitter with handle dimosfactcheck but we also want launch on reddit meantime please feel free submit postsarticles us this thread on our twitter or on our discord we will factcheck your link for you,F,2020-08-17 13:14:09,111,0
The aftereffects of COVID-19 are “no worse than the flu”? False,not everyone heals from covid same for some people aftereffects linger on for while,F,2020-08-14 16:04:53,17,4
School reopening and COVID-19: 5 things to know,backtoschool season almost there yet covid still lurking we look at reopening schools during pandemic,F,2020-08-06 20:59:00,20,3
Lightning Fact Check - Tal Schaller,reader her friend are wondering about reliability tal schaller video we investigate find out that information brings forward shouldnt be trusted,F,2020-08-03 17:05:10,29,0
Vaccination: why do parents hesitate? It’s complicated.,why are some parents worried about having their children vaccinated we investigate,F,2020-08-03 17:01:57,12,0
Fox News - Fake News,this story about chicago gun violence always pisses me off why do people talk about chicago all time tldr here that guns chicago are coming from out state s chicago mayor blaming those states fox news turns around says why dont those states have crime problems answer isthey do birmingham al violent crime rate twice that chicago congrats no one does theyre own research,F,2020-08-03 14:03:24,78,0
Police seize rifle of St. Louis couple filmed waving guns at BLM protesters,couple were filmed as they emerged barefoot from their lavish mansion central west end neighborhood each toting firearm as protesters marched down their private street toward home mayor lyda krewson its lie they entered their private property via gate destroyed gate they also threatened burn down house kill them,F,2020-07-11 16:25:45,64,5
Rumours about Colby bricks death,i am here reassure everyone colby brock indeed alive well do not listen rumours stroke or car crashits fake,F,2020-06-30 12:05:22,26,1
Instagram girl accuses CVS La Habra of falsifying COVID-9 results,this girl trying say that cvs falsified lab results this being criminal accusation i wonder what can be done heres what i posted that immediately got deleted this looks like scam hi medical lab scientist here cvs doesnt send letters or phone calls those are easily falsified cvs uses an offsite reference lab that fully automated through system called epic at cvs epic system doesnt generate identification labels unless patient shows up its called an encounter on system pcr testing method she said was used big machine results transmit directly epic system that gets forwarded directly patient pcr cannot detect what isnt there its pitfall false negative this criminal accusation that can lead licenses being revoked nurse practitioner whose name present cvs have been notified do not spread false information for clout typo on title havent posted before how does one change,F,2020-06-28 06:46:32,178,6
Trump’s latest campaign ad is a microcosm of what has happened to our sub.,ad i will be discussing here campaign plays video with fake cnn bottom third on displaying an obvious lie about video this what fake news meant when we started here somebody pretending be media outlet lying about something make either outlet or subjects story look less trustworthy or some way bad however this ad goes on claim that media problem even though theyre ones making up this story closes with some rubbish about how only you can stop fake news when you see something say something so im posting here even though this place has devolved so significantly cnn response video cnn coverage original video,F,2020-06-19 16:16:30,135,4
How are you protecting yourself from misinformation?,today misinformation has become rampant problem media social media communication apps events have made clear for everyone see not only misinformation but also propaganda can be easily spread through society are you taking measures identify check misinformation if so how are you doing this what are your qualms with media social media do you have any tipsideas for rest us disclaimer i work tech space dedicated solving this problem want know what others think these issues,F,2020-06-14 10:11:13,97,6
Fake News?,im sorry i thought this reddit was for exposing fake news for creating,F,2020-06-13 06:53:40,16,5
News Is Hiding the Martial Law,i dont know where post this so trying anywhere i can that seems appropriate someone else on here suggested this i thought i would give try i know world hell right now but i think i may have some you beat we are americans stuck philippines not on vacation i was working had no clue about corona until i had soldiers telling me i cant go outside we are only renting cannot afford rent we have no money for food we are allowed go out only day week with special pass its been months now news says that rules are relaxed people can go out now all lies we cant work we cant go ask for help only hours week out buy food those hours are left standing line for food often we can only get cans sardines ramen noodles for people for week there are death squads here bandits terrorists philippines does not have anything like food or cash aid not for foreigners at least even though i pay taxes here on top all that its been degrees here they make houses here with just metal roof no insulation at all we dont have fridge ac or even furniture we do have fan water kettle rice cooker currently electric bills are deferred we have kids i dont want see them die i dont want this be end our lives for those that do not know us embassy offers no help at all us citizens abroad nothing i will post links email quotes for those that doubt me heck us citizens services not even open we do not have goal for help we are long way escaping we have child born here which under philippine law makes them an illegal alien that entered country criminal at birth seriously so after getting their passport we will have deal with their immigration paperwork fees before baby can go i am just going screw off rent for now sorry we just need some food basically anything helps if someone could spare bucks i could make keep us alive for another week maybe only thing government has done during this martial law shutdown biggest news agency create cyber terrorism law arrest anyone complaining online so i cannot post anything public i cant post pictures public here but i can post photos from home i am willing provide any documentation private passport id birth certificates etc one friend sent us little some time ago paypal worked with just an email address so that would work for me i dont know what else thank you for reading,F,2020-06-12 13:59:08,508,4
24 fake rumors about the George Floyd protests debunked,below article debunks many rumors pieces fake news that have made rounds recently written up by cosmopolitan but with nod approval from snopes protester did neither set fire walmart nor hospital looters did not kill dallas man trying defend his store but there was such case st louis police do not make use child soldiers protesters did not storm houses washington they did not kill two police officers north dakota see below for many more,F,2020-06-12 12:22:17,95,4
Total lockdown in India after 15th June? Stated Hoax by Zee news,recently image being rolled over all around india image which claims that central as well as state government india has circulated notice extend lockdown india yes you heard right but this wont be same as previous one image says after june there will be total lockdown india no one will be out for any reason this total lockdownbut wait this hoax this image went viral on facebook as well as twitter many reporters other news channel also contacted about this issue zee news zee news clearly stated that image purely manipulated has no concern with zee news also color template different from what we use you can check them below images fake vs real news lockdown india x b after photo went viral official team zee news came live on facebook stated this image as fake also warn every one that not believe these rumors many hoax news were being forwarded on social media i recently got an image about mumbai locals starting from june which turned out be fake same incident was placed on bandra station where thousands people gathered together on rumor about indian railways trains are active after several official warning by police still some people are doing unethical activities currently everyone under pressure due huge increase coronavirus cases registered daily india report from who says india ranks on th place for having highest number case which registered till now with deaths read more here x b zeenews fakenewszeenews,F,2020-06-11 09:13:01,291,3
False statistics used by top networks have disgraced the BLM movement with a false narrative which will not solve the main problems at hand,fake news by russia today rt other news networks which serve as sole international networks for many countries are reporting false statistics alter narrative protests incite anger towards wrong groups visit blog here for more details,F,2020-06-06 18:36:35,43,5
What is this sub?,this sub claims be fake news fact checker subreddit but seems like any fake news that supports leftwing views downvoted dismissed posters attacked arent you ashamed yourselves,F,2020-06-06 16:59:58,34,5
"Mainstream Media caught again spreading misinformation, this time on Hydroxychloroquine being a ""deadly"" COVID-19 treatment.",remember when mainstream media pushed narrative that taking hydroxychloroquine as covid treatment dangerous deadly for you source source source well turns out nowretracted lancet study they sourced their content from has flawed data source source new england journal medicine study which found taking hydroxychloroquine as covid treatment not as dangerous but just as effective as taking placebo drug so its effect on covid useless as well got retracted same day lancet study was retracted thursday june same authors by way if this happens so nonchalantly with public imagine how many times they do change public perception government policy question everything this only goes show you how easy sway public perception perception multiple governments on universally everything anything so easily swiftly how much media scientific community can control our day day lives,F,2020-06-05 09:53:14,173,4
Those palm say it's not,why cant people that post pictures such as this be more careful,F,2020-06-03 22:17:11,13,2
"Looks fake - r/gifs submission - ""Police attack peaceful protestors & press in Washington D.C.""",there no news logo watermark video that i can see has generic news like banner this fake was this even washington dc reddit link video link,F,2020-06-02 07:34:38,39,1
Making of: fake news,i had good fake news story my head if i make look like an actual article would this be right sub post on,F,2020-06-01 19:30:31,29,0
Squash the narrative,i just wanted say thank you for creating this sub shows that there are people out there who are aware whats really going on background journalism today general public on strings puppeteer seems news corporations use their influence gain viewership control politics sway public opinion people are oblivious that powerful individuals control how most world thinks functions,F,2020-05-30 09:46:29,74,5
