title,text,Fake or Real,date,num_text_numerical,weekOfDay
The /r/fakenews FAQ,what fake news fake news not new concept but digital age has given new powerful platform spread material millions users fake news cousin bad news which ranges from subtle mainstream media bias lazy writing poor fact checking fake news more blatant iteration this often spread for political purposes fake news appears as blogs or news sites that seem comparable mainstream news sites for sake discussion broadening purposes this subreddit we are also including memes fake quotes other bad information that spread online who involved with fake news bad information spread via direct process along these lines originators high level spreaders low level spreaders originators are individuals who actually create fake content spread often they are posttruth trolls or political propagandists there gradient from isolated trolls who do for its own sake those who actually make living off as shown when washington post interviewed an originator paul horner yearold impresario facebook fakenews empire has made his living off viral news hoaxes for several years he has twice convinced internet that hes british graffiti artist banksy he also published very viral very fake news yelp vs south park lawsuit last year high level spreader larger operation blog popular facebook group fake news website that spreads material large audience with very little effort generally an originator will also run high level spreading operation at same time making easier for them finally low level spreader consumer these are users who consume fake material then also spread via likes shares fake news partisan issue no wed all like think that our side consuming real information while fake news problem other side but reality this bipartisan issue that will require people introspect little be more vigilant how they consume media hyperpartisan facebook groups have been spreading misleading information at an alarming rate while seems be bigger issue on right its problem for everyone hyperpartisan political facebook pages websites are consistently feeding their millions followers false or misleading information according an analysis by buzzfeed news review more than posts from six large hyperpartisan facebook pages selected from right from left also found that least accurate pages generated some highest numbers shares reactions comments on facebook far more than three large mainstream political news pages analyzed for comparison our analysis three hyperpartisan rightwing facebook pages found that all posts were either mixture true false or mostly false compared posts from three hyperpartisan leftwing pages that were either mixture true false or mostly false rightwing pages are among forces perhaps as potent as cable news shows that have gotten far more attention that helped fuel rise donald trump as noted this isnt simply right wing problem provide one example on other side quote spread around online about trump calling republican voters stupid was used hurt him among voters both primaries general elections issue its totally fake that viral meme your friends keep sharing donald trump calling republicans dumbest group voters country not true its not thing stop sharing while donald trump has said some questionable things he never said anything even resembling this quote if i were run id run as republican theyre dumbest group voters country they believe anything on fox news i could lie theyd still eat up i bet my numbers would be terrific post says donald made statement people magazine interview except he didnt can you provide real world example fake news process absolutely on october th wikileaks began publish contents podesta emails they were holding around this time there was story spreading online that hillary called bernie supporters bucket losers this quote was found transcript goldman sachs speech was supposedly referenced one emails infowars via american mirror published this material their web site under title hillary calls her own supporters bucket losers gateway pundit also reproduced story wikileaks hillary clinton calls bernie fans millennials bucket losers goldman sachs speech story was also spread via popular rthe_donald subreddit getting multiple posts with hundreds thousands net upvotes this example here shows being posted mods deleted all comments trying notify people story fake deleted comments are red truth story was irrelevant originator this story was fake news outfit called real true news posing as legitimate source information their story can be seen here if you pay any attention details you will notice immediately that story dated october before podesta emails began leak one could also go directly source wikileaks see search for bucket losers podesta email database returns no results if people are unwilling do ten seconds research then what else can be spread if youre fake news troll world your oyster can you provide an example spreader manipulating readers while some fake news stories are totally false lot them start with grain truth this example also from podesta emails specifically this one written by podesta himself i know she has begun hate everyday americans but i think we should use once first time she says im running for president because you everyday americans need champion i think if she doesnt say once people will notice say we false started iowa if you actually read email understand its context you will know that they are referring term everyday americans not people who make up group designated as everyday americans do you think thats what politically motivated fake news spreaders want you think usual suspects went work gatewaypundit wikileaks bombshell hillary advisors admit she hates everyday americans infowars wikileaks bombshell hillary clinton hates everyday americans written by paul joseph watson who had later take down article shame but he already got his message out right wnd hillary campaign manager i know she has begun hate everyday americans drudge season witch hates everyday americans i will focus on infowars article show further how readers are manipulated most readers have short attention spans so they do not read entire articles thats why its so important for writers know that they need either make an impression early keep reader interested or emphasis what you want at top now removed infowars story bolds their summary at very top doesnt quote statement its proper context new wikileaks emails released just moments ago include shocking admission by clinton campaign manager john podesta that hillary clinton has begun hate everyday americans another warning sign readers be skeptical sites that highlight certain sentences or words bold lettering or caps its form editorializing without explicitly editorializing by bolding words author telling reader what important but thats not their job they should be presenting information reader will decide what important paul joseph watson uses bold two more times article this shows how shady manipulative their operation i know she has begun hate everyday americans but i think we should use once first time she says im running for president because you everyday americans need champion writes podesta bolding only one part statement not providing proper explanation what statement actually meant further down this huge so if you just skimmed page you would come away with two concepts hillary hates everyday americans this story huge this subtle manipulation you may not have consciously noticed first time but your brain did can you provide good reading list learn more how fake news goes viral case study this analysis shows how fake election news stories outperformed real news on facebook facebook fakenews writer i think donald trump white house because me how teens balkans are duping trump supporters with fake news we tracked down fakenews creator suburbs heres what we learned plague fake news getting worse heres how protect yourself solving problem fake news google facebook move restrict ads on fake news sites fake news an insidious trend thats fast becoming global problem hyperpartisan facebook pages are publishing false misleading information at an alarming rate site fake news watch,F,2016-12-04 16:52:14,1618,6
Crowdsourcing platform to fight fake news,screenshots below illustrate how user with extension will see alternate titles made by remedia userssion i have created crowdsourcing platform that has social media network chrome extension that enables users create join groups users can create exposing articles link them fake news pages by doing that they will help others because extension will show warning allow user read exposed article by installing remedia chrome extension article exposing truth will be visible on page itself so if you come across fake news article extension will warn you by showing related articles written by remedia users chrome extension allows you substitute clickbait or misleading titles with your own because this crowdsourcing social network others will be able see your work you will be able see others as well chrome extension can be found at when you install extension you will see other peoples contributions if you log you will be able contribute also social network below screenshots illustrate how user with extension will see alternate titles made by remedia users platform also allows users dislike certain aricles write opinions about articles products people write claim reviews all content written by users when matched with page will be visible user by remedia chrome extension x b if you have questions feel free ask or just install extension have fun ps screenshots are croatian x b x b,F,2024-02-20 07:53:00,284,1
"I like the Epoch Times, but its German version spouts more insane propaganda than Goebbels!",hi i just found your subreddit originally i didnt want post this on reddit at all but i think here really fits though not same way that most posts on here do cause most posts on here just consist link one fake news article well my case fake news articles are so many require some explanation translation so instead linking directly fake news ill link my own article where i try raise awareness about issue i hope that that okay,F,2024-02-16 14:32:04,101,4
Automated-fact checking with AI,hey factcheckers at factiverse we are developing researchbased ai services that help users with finding credible online information do you find timeconsuming task manually search for relevant online sources verify content generated chatgpt download factiverse plugin let our ai spot factual errors fetch credible sources from leading search engines realtime were excited announce that from now on you can use factiverse chatgpt if you are already plus user you can get early access for free spot controversial sentences fetch credible sources realtime without leaving chatgpt are you using chatgpt generate your articles afraid costly factual mistakes spotting controversial claims finding credible references tedious work will always include some manual thinking decisionmaking however factiverse chatgpt plugin will help you speed up process usecases expanded use cases journalists editors validate facts from your sources factcheck your competitors write highquality articles no time students academics ensure your research academic discussions are backed by verified data get instant online references on any topic business professionals make informed decisions with realtime information validation during strategic conversations content creators amplify credibility your content ensuring verified sources back every claim check out learn more would love hear your thoughts feedback how could this speed up your factchecking efforts even further,F,2023-11-09 12:35:17,243,3
Are there any recent examples of Denying the Antecedent or Affirming the Consequent made by a news website/report or a statement by a political/famous personality from August of this year to the present?,its for my highschool school work i prefer simple ones thanks so that i can explain easier,F,2023-11-07 06:29:08,18,1
fake news,hi guys can you give me some fake news i need make presentation about fake new i didnt get an idea funny one,F,2023-10-25 21:33:00,31,2
More proof facts matter.,now if i can just get my family stop watching fox news study examines what drives beliefs even if you desperately want continue believe that sun shining so you dont have cancel planned picnic you cannot continue believe not raining says joseph sommer postdoctoral researcher cognitive psychologist rutgers center for cognitive science on other hand second type belief processing can be controlled by desires if you want look only for evidence that agrees with you ignore opposing views or try reason away any arguments that disagree with your beliefs you can do so,F,2023-09-20 20:28:10,114,2
Detect controversial claims and get credible sources to any text generated by humans or ChatGPT,hello fn after years dedicated work were thrilled unveil factiverse ai editor revolutionary tool validate or debunk factual claims any text including aigenerated content counter fake news misinformation we need faster more reliable overview sources out there not only based on seo or commercial elements hope you guys want check out heres how works our cuttingedge machine learning models analyse your text identify checkworthy claims we then scour search engines like google bing wikipedia alongside manual factchecks retrieve supporting disputing evidence credibility each source carefully assessed using another machine learning model trained on expert factchecks try out factiverse ai editor at get started check out our tutorial video at hear special message from founders at join us revolutionising factchecking with ai very curious hear your feedback thoughts what should we develop next ps you can use factph get one month for free after weeks free trial,F,2023-06-26 10:28:32,183,0
"How to silence truths with the argument of ""stopping fake news""",x b translation first they claim that they just want end fake news then they put stamp fake news every truth that bothers them context last year during brazils elections superior electoral court forbade people from associating lula with maduro ortega then after he won he not only invited maduro but gave him welcoming visit proving even more that they were always friends showing that end you can do meta fake news claiming something fake news when isnt silencing truths,F,2023-06-01 11:07:47,93,3
No resident of North Korea is allowed to have the same name as Kim Jong-un's daughter!,i found this extremely intriguing i wonder how they would even keep tabs on names maybe going through all birth certificates surprisingly i found some interesting sources globally validating this here i use this platform often for misinformation debunking but wanted get yalls thoughts too,F,2023-03-28 14:58:19,47,1
Prevention about fake news,world lot fake news spreading try influence your opinion or your ways think dont fall for their lies there are ways prevent fake news you always have check source information trust everything you see at tv or internet if some information looks crazy thats maybe because there are fake alaways do your own research be sure your welcome was prof_tekto,F,2022-02-09 10:08:45,79,2
Iran accused of sowing Israel discontent with fake Jewish Facebook group,suspected iranian disinformation unit ran an elaborate network on facebook targeting nationalist ultrareligious jews israel an attempt stoke division inflame tensions with palestinians according research shared exclusively with bbc its goal was help fuel religious war by amplifying fear hatred chaos according israeli disinformation watchdog fakereporter which uncovered groups suspected iranian origin latest sign growing disinformation battleground on social media messaging apps israel network became active after last years flareup sectarian violence country,F,2022-02-05 11:29:27,97,5
2 minute Survey For Misinformation + Fake News,we are capstone group at ischool working on project dealing with election misdisinformation can you help fill out this survey would help us gauge our audience narrow down specificitydirection which we plan take this project thank you,F,2022-02-02 21:59:20,46,2
"“Electric cars do more harm than good to our climate”, “Vaccines cause autism”, “5G is deadly to humans"" - Try our free AI powered fact-checking tool!",tired your uncle making up claims during family dinner factcheck claims faster using ai at factiverse we use ai ml nlp help researchers journalists find most reliable sources we have just launched our demo which gives you option check any claim or copy your own text check all claims ai built from years research at university stavanger norway its trained on global factchecking articles identify traits signs credibility we scan entire web not just google find most credible sources contrast other factcheckers we do not want tell you whats true or not because if we want combat spread fake news we need become better at identifying assessing sources on our own we do believe ai tech can make this faster process give you faster overview given subject topic or claim we are at an early stage but if you want have look test our demo you can find here use select claim or type your own get an overview sources disputing supporting or conflicting copy your own text easily factcheck claims see how balanced your story our goal make faster easier for people understand information around given topics how much disputed how much research done on subject what are most reliable sources on both sides claim what do you think this tool that could help promote critical thinking we want build more interactiveness so that you would get prompts about thinking twice checking what sources there are etc hope this fine post here let me know if not ill delete,F,2022-01-31 10:59:52,327,0
Where can I post probable covid misinformation to get peoples take on it,hi hope this best place ask this had look around credit cant find anywhere for this i bunch my friends have been emailed something which i think covid misinformation there reddit or other forum i can post details see if correct information ie forum help people fight misinformation by getting advice from people,F,2022-01-29 19:17:50,71,5
Is there any toolkit to validate the location and time of the video on the internet to stop fake news?,i need toolkit verify location time prove my newsis there anything avalibale online please let me know,F,2022-01-23 12:13:41,22,6
here he comes,x b,F,2021-12-10 03:04:35,2,4
The persei mutation,mildly interesting omicron variant has eight notable persei mutations classifying this covid variant as omicron persei,F,2021-12-01 19:06:48,18,2
Why is there seemingly so much fake news coming from Australia about forced vaccinations?,hi all not an australian have never been australia dont have horse race as brit who lives uk however why that i seem hear so much fake news circulating around facebook twitter about forced vaccinations australia feels like every month theres new story usually involving kids there nothing better do there than spread lies,F,2021-11-24 12:03:05,70,2
Survey for Fake News in Modern Media,if you have minute please take this quick survey for qualitative paper im writing regarding use fake exaggerated news modern media,F,2021-11-17 03:30:50,28,2
Youngkin donated 44% to his own charity,fox business youngkin donated over his income charity over years tax returns show,F,2021-11-09 14:37:17,18,1
Witness: Kenosha victim was belligerent but no threat,this article claims following but lackowski who was called as witness by prosecution said he considered rosenbaum babbling idiot turned his back ignored him he admitted he didnt see everything that went on between rittenhouse rosenbaum including their final clash however raw trial footage shows lackowski say that he would consider rosenbaum threat his life had he been running at him this an article that fake news by cherry picking one statement out hours testimony,F,2021-11-07 18:49:24,91,6
Reports Of 'Myanmar Junta Attack' Show Old Footage From Cambodia,khmer times reports myanmar junta attack show old footage from cambodia,F,2021-11-05 22:57:17,13,4
Hello! Please take our survey about fake news on social media :),were group students from ucsd were trying study relationship between fake news social media we would really appreciate if you filled out our questionnaire thank you,F,2021-10-30 17:56:09,34,5
Rumores y bulos sobre prostitución,encuentro esta noticia en de verdad os recomiendo la lectura que es una clara demostración no de cómo se manipulan datos si no de cómo directamente se los inventan no tengo datos pero quiero causar sensación y posicionar una idea soy un periodico serio y no necesito justificar nada pues me los invento x b x b,F,2021-10-29 10:55:30,57,4
"Hi, Is That One Arma 3 Footage News Fake?",bizarre development some indian news broadcasts claimed that pakistani airforce attacked panjshir valley an afghanistan mountain province home about people which currently last major holdout antitaliban forces only problem footage used report supposedly protaliban airforce attack came from popular military simulation game arma footage first appeared on indian news channels including republic tv times now navbharat zee hindustan tv bharatvarsh original video was credited source called hasti tv on facebook which has since been deleted these indian news sources claimed video showed military jet attempting bombing run on panjshir credit pcgamer,F,2021-10-04 07:44:02,115,0
Why is this story only being covered by publications whose web domains originate in SE Asian countries?,there picture joe biden pinning girl dugout circulating internet im trying figure out if legit or doctored so far op reddit thread has linked two sources one from vietnamaccording google ip based us one from singaporeip address whose name shares that province nepal im mostly interested why these domains are mostly linked countries se asiaone being named after province nepal having an ip address singapore other being linked vietnam despite having an ip address us my hunch that these countriesvietnam singapore dont prosecute libel on consistent basis but thats why im here does anybody here know why somebody who would want circulate an edited image would choose do so from company that registered either vietnam or singapore image could be real im just trying get bottom find out whats true,F,2021-10-01 04:06:41,179,4
Fox News claims that Trump gave away all our weapons in treaty with the Taliban,x b,F,2021-09-29 23:46:00,2,2
Is the story of Mike Emme real?,hello im working on suicide prevention project for my university brazil here we have something called yellow september which month dedicated suicide prevention while searching about origins yellow september i keep finding results portuguese about teenager called mike emme who killed himself his yellow mustang parents victim allegedly distributed yellow ribbons at his funneral which inspired association between collor yellow suicide prevention thing i tried find this story on english sources but couldnt find anything except this website which supposed be suicide prevention organization us people who wrote this webpage claim be affiliated with parents mike emme i find very suspecious though that only website where i can find local information that not written by brazilian writters about this case one that directly involved incident no news report no wikipedia page no anything about mike emme other than webpage institution inspired by him can anyone help me clarify this matter this website trustable mike emmes story real or just tale designed inspire people towards suicide prevention,F,2021-09-08 21:29:04,211,2
A holistic approach in tackling fake news and misinformation?,this article describes theoretical solution based on global community assessing content into single content repository on top social media news providers then scoring them raising awareness educating users,F,2021-09-02 20:02:56,36,3
Reddit posts nothing but biased and fakenews,why does reddit allow disinformation biased liberal posts flourish,F,2021-09-02 00:24:21,11,3
Taliban “declaration of Emirate”,on august th hill ran headline on they arent only ones source from taliban twitter but if you look at their history tweets before august th x b you will see that they put declaration islamic emirate on much their important news,F,2021-08-21 13:54:16,60,5
"""Globalist Genocidal Event"" , ""Hospitals are murdering people"" and much more",i recently stumbled upon some stickers placed on bus stops my town claiming that uk government planning genocide against people who vaccinate inviting people join them prayer for those unfortunate be fooled into becoming sheeple system on their sketchy website filled with antivax propaganda extremist prayers whats bothering me specifically vandalism they do by placing stickers made very thin paper so they cant be ripped off with ease website cause can we somehow manage get these guys off media its my first time this subreddit i am not sure if i went right people vent if needed i can move post somewhere else if you guys know place,F,2021-08-21 05:21:10,131,5
CIA Plants Bomb In Costumer's Food.,,F,2021-08-11 16:05:12,1,2
