title,text,Fake or Real,date,num_text_numerical,weekOfDay
The Biggest Fake News In America Is That The Christian Church Is Christian.,cause fascism most bigotries world as well as racism america christian church republican party was created through merger several abolitionist groups from mid s republican party led civil rights movement america for years until church move from leftdemocrats rightgop take political control american right from our founding this this period history church has worked against america our constitution equality first halfcentury through democrats their racism bigotry our society before mid s mid s through gop after church changed political camps this day another halfcentury later documented here for over years year godfaith gop platform christianity its political cause christianity kkk faith government christianity kkk christianity american nazism father coughlin christianity moves from supporting nazis supporting mccarthyism more fascism end mccarthyism note just dawned on my where voices delaying americas entry into war europe when we knew evil being carried out was being carried out at urging church by all circumstances surrounding this entire era who were urging patience here ive no doubt church moves from democrats republican party bringing its bigotry racism with when did present day church moves towards deep state with more money than god corporate fascism via billionaires financing american right many whom are devout fundamentalist christians faith govt st time yo could vote i voted nixon roe v wade decision abortion became legal gop take prolife stance church has been lying about god on abortion world s reagan invites religious right into party enmasse references god faith references god faith this side gop are racist bigot due christian religion democrats are now defenders constitution for free equal america they church has spent its entire history working against free people any free people they world over as search into lie about god on abortion how has been used as wedge issue all over world push nations political fascist right just like church has done here america last years with lie about god abortion democrats are party civil rights american ideals equality freedom liberty that gop had been that personality swap only thing that really happened was christian church changed its political bent so lets go wayback machine follow forward back note there were m germans german people were christian majority catholic then protestant jews were somewhat less than percent population if you thought about you might realise foundation constitution its very backbone built on equality freedom liberty for all americans protect defend those american ideals for everyone who american native born or with american parent anywhere world naturalized citizens per constitution since being american only requirement be guaranteed constitutional rights protections one automatically granting everyone else same right live their life as you do by their choices wo interference by you religion or government x b may our founding senate passed its first act oath act i do solemnly swear that i will support constitution united states oath solemn promise often invoking divine witness regarding ones future action or behavior synonyms vow sworn statement promise pledge avowal affirmation attestation guarantee bond word word honor you cant be an american patriot without defending constitution for all americans as god did giving all free will all republican party american right fail practice their politics or religion by example jesus left us his life american christian political history from today s saw advent then fraternal christian entity known as kkk s christianity continuing be popular today kkk s we had american christianity nazi party german christians embraced many nationalistic racial aspects nazi ideology once nazis came power this group sought creation national reich church supported nazified version christianity bekennende kirchethe confessing churchemerged opposition german christians christian church was power behind hitler do not believe denials search father coughlin american nazism during s s christianity american fascist legacy continues with mccarthyism which takes us into s was last year mccarthy house committee on unamerican activities search mccarthy house committee on unamerican activities search catholic church mccarthyism again churchs fraternal organization this time knights columbus had word god put into pledge allegiance onto our money pledge this meme with its original language along with oathofoffice all take version for any job serving public with government today end mccarthyism civil rights movement we have personality swap democrat republican parties church fascism switched sides between ending mccarthy hearings civil rights movement by kennedylbj early s where democrats became party constitution civil rights gop who led civil right form its inception then became party christianity oppression racism bigotry politics became fascist once more aligned against people making their choices for themselves im not sure there more conclusive portrait power influence christian church carry this off wo being noticed by anyone but folks like goldwater who sounded alarm went war with christian right before him other than eisenhowers warning militaryindustrial complex which fits nicely with creating enemies that dont actually exist any world outside delusions christian lie about god an abortion started during this time free love era s if anticonstitution antiamerican rights equals being domestic enemy constitution then christian church republican party american right are domestic enemies america for over years with or without religion good people can behave well bad people can do evil but for good people do evil that takes religion steven weinberg,F,2020-05-29 10:19:57,1221,4
FAKE NEWS: A Political Weapon,,F,2020-05-27 16:46:40,1,2
The Fake Christian Religion Has Led Fascism Throughout History,christian religion fascism handinhand throughout history someone on right took affront my calling them fascist asked me prove they were easy do you defend constitution answer no do you defend rights all americans answer no what has christian religion conservative right politics you support done church has always done through everyones life documented here for over years so lets go wayback machine follow forward back note there were m germans german people were christian majority catholic then protestant jews were somewhat less than percent population if you thought about youd realise base constitution its very backbone built on equality freedom liberty protect defend those american ideals for everyone who an american native born or with american parent anywhere world since being american only requirement be guaranteed constitutional rights protections one granting everyone else same right live their life as you do as our constitution does only requirement be patriot all american right fails as god did giving all free will all republican party american right dont practice politics or religion by example jesus left us this life our constitution protects minorities even minority states as our lower populated states figuring out through our free constitutionally guided republic give small states bigger voice our government though electoral system distribution electoral votes have you not ever thought brilliance our founders creating document meant give no one class leverage over another no mention ism racism sexism no mention any religions creator could be ones parents that real miracle before us single document for its day given time was created as long as we all get practice our right vote but that hasnt been case gop have been working against free open elections for long time now think about they pushed read id through years ago anticipation this time our history that just too good be coincidence gop failed prove voter fraud gop use voter fraud suppress voting gop election rigging now let us get into christianity fascisms hand american politics throughout history we have republicans on record saying wasnt about voter fraud but suppressing vote winning elections s saw advent then fraternal christian entity known as kkk s christianity continuing be popular today kkk s we had american christianity nazi party german christians embraced many nationalistic racial aspects nazi ideology once nazis came power this group sought creation national reich church supported nazified version christianity bekennende kirchethe confessing churchemerged opposition german christians christian church was power behind hitler do not believe denials search father coughlin american nazism during s s christianity american fascist legacy continues with mccarthyism which takes us into s was last year mccarthy house committee on unamerican activities search mccarthy house committee on unamerican activities search catholic church mccarthyism again churchs fraternal organization this time knights columbus had word god put into pledge allegiance onto our money pledge this meme with its original language along with oathofoffice all take version for any job serving public with government today end mccarthyism civil rights movement we have personality swap democrat republican parties church fascism switched sides between ending mccarthy hearings civil rights movement by kennedylbj early s where democrats became party constitution civil rights gop who led civil right form its inception then became party christianity oppression racism bigotry politics became fascist once more aligned against people making their choices for themselves im not sure there more conclusive portrait power influence christian church carry this off wo being noticed by anyone but folks like goldwater who sounded alarm went war with christian right before him other than eisenhowers warning militaryindustrial complex which fits nicely with creating enemies that dont actually exist any world outside delusions christian lie about god an abortion started during this time free love era s if anticonstitution antiamerican rights equals being domestic enemy constitution then christian church republican party american right are domestic enemies america for over years note church absolutely needs lose all tax exemptions if charges or fines possible they should be high enough bankrupt them imho they have purposely broken sacred trust between person their god their belief use against them i would go as far as seize vatican as world museum then thorough investigation all its actions through history document evil that manmade religion all manmade with or without religion good people can behave well bad people can do evil but for good people do evil that takes religion steven weinberg mentions god faith gop platform year godfaith gop platform search suggestions christianity kkk christianity american nazism father coughlin move mccarthyism end mccarthyism move towards deep state with more money than god faith govt st time yo could vote i voted nixon roe v wade decision abortion became legal gop take prolife stance church has been lying about god on abortion world s reagan invites religious right into party enmasse references god faith references god faith gop bragged about all those thousands seats power they had gained across nation very grassroots effort that resulted this map color saturated show voting precincts across america was taken from an interactive voting precinct map washington state student references god faith record number republicans with sense personal integrity leaves government during this midterm election how political correctness help establish fascism america they lied faithful about god with faithfuls bibles laying right next them give them gods word will but they didnt open their bible they didnt read their bible they followed lies those who led them still do so today abortion as ritual church carried out by god priesthood test for an unfaithful wife law jealousies numbers specifically then republican party created their litmus question on abortion further compound lie that they would put every member party litmus question do you support abortion if they responded yes or indecisively you were out republican party odd thing that that very heart fascist policy you do not question party you follow party policy dictates period just like trump such stellar example that attitude being so prevalent across board on right today why record number republicans iirc left office at midterms retired follow american rights fascist history with search engine note i use searches so all can see trail american right has been on for years towards fascism i dont cherry pick what i offer my poststances i dont make my history up as american right has done for last years if they pay attention theyll see lies right backdropped by links that prove those lies why i can be factchecked encourage people do that my memes can also be factchecked search attributes fascism religious right fascism american fascism gop fascism trump fascism mussolini fascism trump mussolini trump x b do you care there was no american flag sight at democratic debate,F,2020-05-26 11:26:05,1526,1
The need for popularity in social media is the fuel for fake news,x b source gag i know gag not trustworthy source info anyway but i find interesting depressing that people are willing blatantly lie just get some worthless popularity on internet,F,2020-05-24 12:30:02,40,6
Need rules around clearly posting links to fake news so we can understand OP's perspective.,there are lot time where intent poster really unclear could be link an article its hard understand if linked article fake news or article pointing out fake news i get that sometimes submitting link you dont want make title too long but cases like that its probably better just do text post with link explanation far too often i find myself not sure if i should upvote or downvote because hard understand ops stance on linked post,F,2020-05-22 19:17:15,105,4
look at the use of PPE and personnel in this staged photo shoot,,F,2020-05-18 11:04:56,1,0
Guy Exposes Fake News in Thorough Fashion on FB,take look share if you hate propaganda machine that puts innocent americans at risk with their health this guy breaks down educates not just what fake news but how spot x b,F,2020-05-17 08:07:38,39,6
"Next time someone tells you that the media has no bias, show them this",x b clearcut example media bias,F,2020-05-11 22:34:51,7,0
Don't fall for misinformation,,F,2020-05-09 01:15:08,1,5
Community-driven platform for identifying fake news won the EUvsVirus Hackathon! We're now looking for additional team members + insight / feedback from the community,three weeks ago i shared medium article on this subreddit discussing potential strategy streamline process identifying fake news order ensure that identified quickly before gaining widespread traction b ensure that this effort carried out worldwide all languages as opposed being concentrated professional fact checking teams most developed nations following feedback from friends family community i decided submit concept euvsvirus hackathon by some miracle lot hard work on part our team we won first prize category mitigating spread fake news one teams win first prizes their respective categories out total hackathon submissions with over participants you can find details our submission here including functioning adobe xd frontend prototype our github repo if you want have look at other winners you can find them here we now have opportunity take this project forward matchathon may order connect with potential funders stakeholders experts however we are urgently looking expand our team we have great frontbackend devs we have people who are looking at legal component people interested business plan marketing but what we are still missing lead frontend designer we are looking for someone who proactive good at what heshe does who willing volunteer decent amount time since there as yet no funding involved we are all doing this on voluntary basis if you feel you could help out want contribute positive way tackling part this crisis or if you know someone who fits that description please contact me via pm just clarify current platform design as well as name logo were just quickly mashed together for hackathon all this can still be changed secondly would be incredibly valuable get some insight feedback on our concept from you dedicated community people who are already doing exactly what this platform intended for identifying fake news essentially platform would help streamline excellent work you guys are already doing ensure that resulting content classifications database can be easily accessed by legitimate parties order inform their strategies for dealing with fake news content if we develop this concept further would you be interested using such platform why why not what would motivate you keep using platform we are considering strong gamification aspect ranks leaderboards teams badges for various achievements unlocking additional platform features as you rank believe community aspect website forums for discussion working together with team on reviewing same article will be crucial order keep people engaged do you have any other suggestions do you see any pitfalls or holes our concept problems we may not have considered which need be addressed make this viable solution finally if anyone has any thoughts on potential partners we should approach that would also be incredibly helpful terms platform tools which we need adobe aws are official partners hackathon so we will contact them get access adobe tools such as adobe stock aws servers we will need an input feed content which has been flagged as suspicious which gaining traction which then needs be factchecked by humans we can try develop this from scratch but i think we should first reach out companies such as google twitter facebook since they likely already have such algorithms place are there any other parties which you think could provide this we will need access database content which has already been reviewed by professional fact checkers use as benchmark data establish reliability score our public users we are considering reaching out full fact international factchecking network are there any other parties which you think we should contact for this terms endusers our content database who can then use content classifications inform their strategies for dealing with different types content we are thinking social media companies news websites content aggregators such as news feeds as well as other legitimate parties such as nato who fake news researchers can you think any other potential use cases endusers for this type content classification database terms funding we are essentially looking for any company organisation government entity who interested contributing tackling this infodemic without necessarily expecting return on investment as monetising platform only last resort option we will likely function as nonprofit eu commissioner has already informed us that most hackathon partners he has talked are not looking for roi just want help out which great i believe there are many parties that stand gain from less fake news whether coronarelated or otherwise so if you can think any organisation who might have an interest sponsoring this platform do let us know,F,2020-05-06 11:36:33,929,2
What are some well known fake news websites?,im trying build simple fake news classifier as university project need data from fake news articles couldnt find readymade dataset fake news article that why i am trying build one are there any well known fake news website not satirical websites like theonion im especially trying identify news based on these different categories,F,2020-05-02 17:31:05,66,5
Annoyed by this video - NSFW,so this video now floating around fb claiming be florida i personally think from ecuador or maybe even totally unrelated covid possibly posthurricane video from past years with new audio over top ive searched high low for video that matches this one but have had no luck link fb post facebookcomrealdlhughleyvideos backup link video case deletion,F,2020-04-30 16:46:51,73,3
#EUvsVirus - Fact-O-Meter,hey people out there we participated on eu hackaton i just wanted know if this product seems be worth its time effort what do you think about please share your opinion thank you advance,F,2020-04-26 22:03:26,43,6
How do I have a conversation with my mother who is sending misinformation?,some context growing up i always observed my mom as someone who incredibly socially compassionate with progressiveleft leaning views that said she also views her ideals as most paramount sometimes appears fail see bigger picturereality she voted for nader she has rejected notion establishment politics started check out she voted for obama first time around but i think started feeling politically apathetic did not vote at all she has always been someone who considers herself free thinker as deep mistrust for mainstream news outlets she has turned more alternative news sources claims do research for what really going on problem anyone can post anything on internet i believe she fails see red flags websites she finds herself on lately she has been sending my whole family links jon rappoports content conspiracy theory laden articles regarding corona virus cursory google search shows that he regular contributor infowars has also posted articles saying mental healthcare hoax etc i should also mention that she decided not vaccinate me as baby i have since vaccinated myself unbeknownst her she also someone who for years would send links about chemtrails etc question i get really triggered when she sends this stuff because i know her heart right place i love her but stuff she shares believes dangerous i want be able have frank conversation about i am afraid she will get defensive not listen i believe she finds comfort feeling something else going on or that someone pulling strings but i am not sure how best approach itwhat resources fact based yet compassionate arguments i could make try persuade her at least not believe misinformation tldr how do i talk my mom about how misinformation she spreads dangerous thank you any tipsresourceslinks for how concerned son can handle this would be so appreciated,F,2020-04-20 04:30:08,369,0
Let's Fight Fake News Together,fakepatrol hi everyone during this pandemic we wanted help minimize spread fake news misinformation fearmongering messages my team i developed this platform help combat this issue we wanted have way for people report fake articles people can vote legitness such articel say crowdsourced way identifying validity news id like you check us out let us know how we can improve we recently published our website we want have users our platform rich content for verification try out lets contain spread fake news together let me know if im violating any community rules or im wring subreddit ill take down my post thank you,F,2020-04-19 11:46:29,133,6
Broadway star Nick Cordero had his leg amputated due to coronavirus complications,from cnn just one many reporting this way though fake news or just manipulating circumstances their advantage not just cnn on this one would seem that every outlet ive run across has said same thing here oooooh he had this amputated cuz virus reality while hospitalized he started having clotting issues on his right leg could not get blood down his toes fake news if you ask me x b view poll,F,2020-04-19 13:58:31,78,6
This is my thoughts on why Fake News are popular.,something like fiction people hope read or hear about news that they hoped for even if far fetch or nearly impossible so folks will google search based on things that did not happen but they hope happen someone on internet just happens capitalize these demands start churning up with fictional fake news with lots imaginary details false facts back up people get addicted like they do with game thrones before you knew fake news now good news people choose believe what they believe fulfills persons sense self satisfaction works especially well on political conspiracy views since usually theres no proofs,F,2020-04-14 02:21:13,130,1
Fact Check: CNN using Huricane Harvey footage for COVID-19 report.,ive seen this shared all over place cant find any video about what context was anything just this guys image being reshared on twitter fb image,F,2020-04-11 14:37:08,30,5
