title,text,Fake or Real,date,num_text_numerical,weekOfDay
"Which UK news sites, and sites in general, are trustworthy and which ones are fake news?",so my boyfriend was just panicking because news site called expresscouk has posted multiple articles about world war scare clearly looking for clicks theyre only site who have said anything on ive decided i dont trust this site but i dont know which sites i can trust so if anyone could tell me some stay away from some that are reliable thatd be very helpful sorry if this doesnt belong here,F,2021-02-06 18:27:18,79,5
How to Combat Fake News,my opinion two most important cause proliferation fake news clickbait hoaxes majority popular application youtube which where i see majority news about things like election coronavirus this application however notoriously known for something called clickbait which essentially putting false image as cover for video enticing people into watching when reality doesnt actually have what cover displays video i would say majority videos are clickbait especially when comes biggest youtubers they systematically use clickbait entice people reason why application has become such cesspool where people with good content with real news information are not heard clickbait videos run away with views proliferation fake news called hoaxes another main cause hoaxes happen almost daily are something that people frequently buy into believe full heartedly an example fake news hoax that happened recently my favorite rapper by name lil uzi vert had hoax blow up saying that he was dead this led many fans say their condolences internet go crazy wasnt until he actually came on social media addressed this hoax cleared air but things like this happen all time make hard believe when something actually happens or someone actually dies things that i do on an individual level combat fake news are make sure i dont immediately buy into what i see on internet fact check my sources also i make sure view only news sources i trust which normally bbc on societal level social changes i can make combat fake news are not believe what everyone says people telling me fake news false facts happens almost daily something that very frustrating makes me stay on my toes because you just truly cant believe everything you hear especially todays day age on an organizational level what businesses organizations could combat fake news by doing things like keeping employeesmembers informed so that way they arent listened word mouth or any other source fake news if i could design an application fight against fake news i would make an app that would monitor all news outlets stories told you whether or not was fake news so you could either submit an article or whatever you are curious about on app or you could view top news stories that looks into daily i believe this would be good way combat fake news would be essentially fact checker that could keep people know about events avoid confusion with fake news,F,2021-02-01 07:33:44,497,0
US Launching Digital Dollar to Combat Digital Yuan,has anyone heard this or know anything ive been following both sides for past few months but nothing has made headlines or anything,F,2021-01-23 22:08:33,25,5
[Request] Request for interviews with experts on Fake News,i am conducting research regarding fake news detection i would like know if possible for me contact experts domain i would greatly appreciate if experts fake news domain would be able dm me regarding this,F,2021-01-23 10:56:15,47,5
Can we turn this into a joke subreddit like The Onion?,i havent done any research into this sub or anything else please do not leave comment or i will have block you potentially report you fbi for being at capitol riot,F,2021-01-16 09:32:39,37,5
"Came across a great example of the often stupidly simple origins of giant fake news stories, at the end of an ABC article fact-checking a guy that tweeted a bunch of false information about Trump losing his pension, travel stipend, etc and not being able to run again due to the second impeachment:",when we called costiloe tell him that we were planning fact check that much tweet was inaccurate he said goodnaturedly tear new one go for baby he said he nobody man who lives with diabetes texas did tweet because he had seen information pop up somewhere on his facebook feed made me feel good he said he was never sure content was correct was amazed tweet went so viral he said he had only twitter followers at time he posted i dont want mess up world i just wanted make me feel good he said turns out made lot people feel good,F,2021-01-15 21:21:10,132,4
Calling Everything Fake News,question everything what comes mind when fake news brought up think for yourself find your own truth difference between these two when someone an authority position calls everything fake news they arent asking you question everything they are telling you believe them with out question as they are sole purveyors truth whats worse when dissidents do fact check sole purveyor truth they are ignored as requested as they are fake news so no matter how easy find more objective truth through research or an open mind masses close their mind believe what their bias already suggested what their truth teller whether person or organization has already told them how do you reach these people how do you get them question everything yet again think for themselves help,F,2021-01-10 14:04:25,151,6
#ItaliyDidIt Leonardo story of Italian Hacker Affidavit raises some serious red flags,hi all itsmrzombie here from tiktok conservative republican just wanted share some major red flags i found on italygate italy did story i hope this right place be posting something like this leonardo story starting go viral so i conservative did deep dive into organization nations action nia going forward pushing this story found some things that raised some pretty big red flags feel its my duty share this info stem spread misinformation if end up being fake heres my second explanation nia organization second look into maria zack first red flag do quick breakdown nia references an italian editorial section youtube video by an alleged former cia agent brad johnson who owns intelreformorg italian newspaper references an interview between brad johnson intelreform how does one interview himher self also references nia intelreform references italian newspaper nia that triangle references raised led flag for me led me dig deeper into nia second red flag nia owned by maria zack lady video interviews maria zack former lobbyist from georgia she lives florida now lobbyists are good at things talking people raising money she mentions times about needing money see this through third red flag timing story breaking jan th rang some bells for me so i decided look into nia organizations website what other content press releases do they have i started by going back time with archiveorg turns out that story broke january th odd but not smoking gun so lets go back jan th then bam red flag jan th their website claims following nations action instrumental uncovering greatest election fraud american history jan th statement was different with no mention election fraud no mention this breaking news voice american family working for success our nations families by advocating for government accountability transparency rule law godly principles upon which our great nation was founded for shits giggles i went further back saw that their site was redesigned after november rd from early was simple page landing page for donations odd right why would references pointing website that just recently changed their home page look like its fighting election fraud th red flag affidavit linked press release on nia what seems be cell phone picture document uploaded google drive by inspecting details i found name owner upload same name happens own company that redid nias website dreamwebtec not only that but affidavit allegedly signed italy by an italian hacker english also not notarized my take its my belief that this affidavit story are full holes tightly knit reference circle jerk combined with requests for donations makes me think that this an attempt play on hopes trump supporters defraud them donations help cause end anyways these are just some red flags i found wanted share there are smarter people than i out there ether i would like hand this off them follow up on look into as much as id want see proof actual fraud i oppose misinformation time where republican party suffering from severe emotional whiplash i believe that misinformation will only further kill spirit republican party while making them laughing stock left for grasping at straws x b edit dang misspelled italydidit tag title forgot italygate edit as ive been permanently banned from tiktok without reason im assuming because i dug into stories like this too often filed an appeal very same day but havent heard back from them yet kind bummed but i knowknew that talking about even when im disproving them fringe theoriesconspiracies had risks hopefully tiktok manually reviews my content instead ignoring edit thank you for helpful badgeaward much appreciated,F,2021-01-08 20:37:05,771,4
US Fish and Wildlife Service to put Corvus Brachyrhynchos on endangered species list as so many Republicans have to eat crow,x b,F,2021-01-09 03:04:39,2,5
How to do a fact check | Digital Workshop,this browser extension working better than others ive tried so far check out logicallyai source this youtube video by newslaundry,F,2021-01-07 07:45:59,21,3
Quote about fake news from 3000 years ago,mind does not accept truth there no patience with reply an opinion all man loves his own words everyone crooked core honest speech has been forsaken khakheperraseneb bc,F,2021-01-05 09:48:08,41,1
Anti-vaccine in France,hi guysthis guy recentely hit french trend on yt because his humorous videos about covid now he propagating conspiracy theories about vaccines his last video has been deleted by yt because this so now he has uploaded on fb please signal this video,F,2020-12-30 08:54:47,50,2
"Are there any plugins to check credibility of sites? Like a Moz bar for DA, but a truth bar?",i know this grey area truth but at least if there was way scan site for credibility its sources quick fact check on statistics quoted etc or find doctored images could be great way allow people surf internet they want read not wade through misleading crap,F,2020-12-29 18:37:17,61,1
Big King Willy of the Neverlands Kicks Mark Prutten out of Parliament.,big king willy celebrates with people as mark prutten has manic episode gmt big king willy neverlands kicks mark prutten out parliament after dreadful christmas celebrations people are delighted with this achievement hoping return new new normal which should be more like old normal king said christmas celebrations were horrendous this year this why he had pull plug on mark pruttens reign insanity neverlands was recently called mythomanialand by several dutchy farmers broertjes earlier this year after they were unable correctly trade their marijuana big king willy thought this was one step far decided take extreme measurements few months ago fuc medical research center hamsterdam discovered that marijuana can be used as good cure corbola virus according king mark prutten was plotting place high taxes on marijuana so he could line his mothers pockets with money king said what about farmers they also need money little faggots like mark prutten dont even make children king has children he knows what its like grow new people but mark prutten faggot he just simply does not comprehend he would rather take up batty being such good family man big king willy rest dutch citizens decided would be best if we get rid mark prutten this because he simply too gay rule country as good as neverlands this has been proven after catastrophic rule during corbola plandemic big king willy says farmers will be allowed trade all their marijuana tax free for five years this help them regain damage taken their economy after six years we will start looking into better tax scheme better regulation market as long as we all survive billy gates nanotechnology corbola plandemic vaccine nole musky bacon hasnt already enslaved us all with chip our brains fnn reports vague neverlands erope billy dekaf dr foluck hefftoll,F,2020-12-26 16:32:50,361,5
Do you think I would be able to develop a program to detect fake news (the easier part) and then have people trust the results? Any ideas for making it really trustworthy?,ive thought about just automating fact checking process completely so checking if answers corresponds across or so websites if argument good if website have good reliability but how would i go about implementing this into real world make as easy as possible use,F,2020-12-22 20:53:40,56,1
This quote I found in a Miss labeled sonic crossover fanfiction fits perfectly,news isnt good theres nothing weve been able do stop,F,2020-12-21 06:43:12,15,0
"Clintons Host Trumps, Obamas: Mole Children on the Table?",ahead december st arrival usns comfort at guantanamo bay clintons will reportedly host trumps obamas at their atlantisian lair off cost epstein island on sunday sources with knowledge situation informed me that poisonous parlay purported be based around pivotal issue regarding fate formerly subterranean cabal smorgasbord that thousands mouth watering mole children packed like delectable sardines aboard comfort april liberation mole children spearheaded by glorious governor cuomo widely praised at time for its humanitarian contributions zeitgeist has been exposed as nothing more than sinister goalpost deplorable plight innocent moleies this weeks leak communique issued from desk potus attorney general barr ordering him divert comfort guantanamo bay has lead revelation tptbs true disgusting plan for ultimate fate precious moleies operation lock them up tptb know that world waking up they can see that new prophet billy strings has awoken masses numbers not seen since william blake operation lock them up their final attempt at crushing light short order kamala harris will bring about case conspiracy linking all living presidents except course jimmy carter because no fucking way hes into this shit collusion with russia china biden trump obama clinton bush hell they may throw gore just for kicks their families dave chappelles clone will be sentenced life guantanamo there they will live lavish ecstasy dining on fine mole child each day us plebs will be left be sold as slaves galactic federation thanks lot trump or should i say q,F,2020-12-11 22:33:05,313,4
What household item is most like Donald Trump?,genuinely curious how people approach this question,F,2020-12-11 22:08:49,7,4
Is this a fake news?,,F,2020-12-10 16:48:32,1,3
The Neverlands Discover That Weed Is An Extremely Effective Corbola-91 Vaccine.,dutchy priminister mark prutten smokes dutch december gmt after months research race find vaccine for corbola virus world was engulfed by starting at end october fuc medical research center hamsterdam have been competition with other major vaccine firms come up with cure fuc claims they have found most effective cure other reseachers have already tested vaccine on patience at fumc medical care facility nearby has proven be effective all cases study performed by bottom top scientologists neverlands released study today which suggests that marijuana best cure for corbola virus recently we imported different strains from different countries all over world mark prutten said meeting today fuc have been working hard create perfect strain combat corbola virus after deep research evidence suggests any strain marijuana plant perfect for building an immunity towards corbola virus any means consumption advisory be edible form smoked or vaporized inhaled seems have majorly positive effect on immunity since latest discovery mark prutten going make new spoedwet after his recent legalization marijuana trade replace mandatory face mask law with mandatory cbd thc consumption law where every citizen will be enforced smoke weed first thing morning this effort fight corbola virus after meeting with treasury mark prutten has confirmed every citizen neverlands should be able pay for cannabis through their health insurance policies once laws have passed hopefully by end week msc billy huts reports fnn erope,F,2020-12-09 17:36:26,314,2
Recognizing Bias,do you tend listen one media source google youtube are familiar media sources that i use explore information online i search up recommendations or hotspots on google often watch them on youtube most resources i found were useful precise such as gunpowder i made last week with google wikihow internet network that provides variety information communication facilities internet allows us find information efficiently we had wait for days receive reply letter past but now only takes few seconds with internets help however going online also means that we will encounter lousy information including fake news how does that affect your understanding events being covered my opinion false information like fake news cannot be wholly prevented there was fake news when internet was not even invented story chinese military general called yuefei good example although yuefei won many battles was very loyal essential emperor emperor still executed him because fake news that described how yuefei would betray country from yuefeis story i also realized that fake news could cause serious issues that are injustice are spread for variety possibilities as for story yuefei fake news causing his death was spread by villains kill yuefei take his position as general we can see that most fake news nowadays describe incredible events like serial murders because reporters social media mostly spread them attract audiences earn profits fake news that aims attract an audience can be very harmful since difficult for netizens identify fake news by going site where an event has happened proof by themselves most them will spread false information within internet as real news quantum mechanics experiment called schrodingers cat can be used describe this phenomenon experiment concludes that if cat inside sealed room with radioactive device that triggers poison that will kill cat but without an observer witness cats death cat considered dead alive although experiment does not contain any scientific basis i still think that experiments thought can be used describe fake news when netizens cannot observe proof fake news then with enough people believing news will become real negative impacts caused by its content will also come true how do you think fake news could influence persons beliefs case an innocent man been wrongly executed china called hugejiletu strengthened my mind hugejiletu young teenager known be blamed for murdering woman public toilet executed at only however after eight years his execution he was proven innocent which shocked everyone since they all believed that hugejiletu was actual murderer this tragedy caused by polices incompetence fake news that affected peoples beliefs before huhejiletus execution many media published fake news about physical evidence that could prove hugejiletu guilty including discovering his blood on victim however only evidence that police collected was hugejiletu walking by public toilet where murder had happened fake news leads police suspect hugejiletu even more further consequences are irreversible not only caused hugejiletus death but also harmed his entire family his parents had bear both sadness public infamous for their entire life even his brothers sisters were often bullied at school because they have murderer their family story hugejiletu had made people sigh but also allowed us see potential harm fake news hugejiletus case fake news changed peoples thoughts causing them believe that an innocent teenager murderer from above i tend believe that fake news false information spread attract an audience that can become real news if many netizens follow lead search engines social media should prevent fake news from being published ease harm one way do this by setting up strict verifications,F,2020-12-03 04:46:28,728,3
"Religious ""doctors"" speaking out against the vaccine",im trying help religious friend mine that has been convinced vaccine vaguely speaking product evil forces he really wants me watch this hour antivax video anyone know what i can say help him i really dont want watch whole video if i can avoid,F,2020-11-30 00:00:55,58,0
Stop pushing biased and insulting opinions on my feed,edit this something i tried post theguardian reddit pageultimately couldntso i post here just case anyine have similar experiences ive been removing guardian news from my google feeds for ages due its biased feeds frankly weak journalism for ages now but no matter how many times ive clicked not interested guardian option still finds push something my feed today i had enough with stupid trump table disses first all im asian so i dont give shit about trump his table size second can you stop pushing your manipulative opinions on rest international community i know you needed push your democrapaganda your people but we clearly dont care push good journalism feeds us not screenshots from random simps on twitter dissing peopleis that newsworthy you atleast send idiots who write journalism like this on probation please this even worth giving salary anyways please stop pushing feeds through google if you cant provide valuable unbiased information thank you,F,2020-11-27 16:44:26,188,4
Passiert manchmal,x b,F,2020-11-23 20:15:23,2,0
One facebook page is claiming that this is a Real Humanoid.,x b,F,2020-11-23 10:21:47,2,0
Where do you get most of your news?,which platform specifically keep mind news organisation online article subscriptions ie guardian or nyp while television mainly your local or national news channel youtube news channel specifically news station or organisation broadcasting or posting videos their news view poll,F,2020-11-13 23:36:34,46,4
A Tweet,x b,F,2020-11-08 16:55:03,2,6
[REQUEST] Coming up with Fake News,hi reddit idk if its ok post this on this sub so i understand if mods delete i have this class uni called social media we were requested come up with fake news that our classmates must factcheck thing i lack imagination come up with something good we mostly deal with pop culture stuff music movies tv etc i have edit pics or videos make my piece news more reliable as well i obviously wont ask anyone help me with that i just need good prompt could any you guys help me come up with something interesting x b sorry for bad grammar english not my first language,F,2020-11-07 14:50:30,124,5
Nole Musky Bacon invests into SpreadShirt,nole musky bacon x b hopes raise funds buy people lithium mines africa jcb,F,2020-11-05 20:52:05,21,3
What’s the best fact checking websites out there?,do you know website similar snopescom factcheckorg,F,2020-11-05 19:52:45,10,3
Marketing Research Survey,hello reddit please take moment complete survey linked below for my marketing research course at washington state university please answer questions thoughtfully based on your initial reaction graphic provided this day age photoshop video editing even voiceovers fake news being constantly circulated through social media various news outlets different pedigrees i am interested studying how difficult for readers identify fake news how much people trust different news outlets after election term fake news became huge concern for public since then impact misinformation has been extremely harmful for public perception on almost every single hot topic media i chose do this experimental project due my own frustration with amount misinformation specifically surrounding upcoming election i myself will use results from this project better understand how avoid fake news learn more about what that makes people trust what they see on internet,F,2020-11-06 00:20:55,180,4
Fake News has a theme song,courtesy vajagra rb x b,F,2020-11-03 22:04:35,7,1
Fake News survey - for Gen Z,hi all id be eternally grateful if anyone could fill out this minute survey relation fake news its for project on tackling fake news possibly developing chrome extension for x b thank you x b,F,2020-11-03 14:17:18,42,1
We just launched Bleepr.ai to flag propaganda/fake news,hi there i am founder bleeprai today we launched simple dashboard which uses ai scalably flag scan items content on twitter we think have high likelihood spreading hate hyperpartisanship strong markers made up rumorsfake news uses linguistic markers its detection if this interesting you please upvote on give us feedback on quality our algorithms on feed,F,2020-11-02 16:30:02,76,0
Seriously though. How do we know what actually constitutes 'fake news',this postfact world we live today there any way be sure anything were seeing on news true i feel like im being gaslighted with completely opposing views there any way be certain sources objective truthfulness ive noticed some media outlets are much more likely misrepresent data but how do i know that all outlets arent spinning their own narrative there anything that canshould be done fight misinformation on personal level on nationallegislative level also how hilarious that tucker carlson cant legally be taken seriously by reasonable people i just found out about this im still laughing,F,2020-10-31 13:32:16,116,5
